type,format,version,timestamp,data_type,data_format,data_version,data_meta_ID,data_meta_ASSIGNER,problemtype_description_lang,problemtype_value,reference_data_url,reference_data_name,reference_data_refsource,reference_data_tags,description_data_0_lang,description_data_0_value,configurations_CVE_data_version,configurations_nodes_0_operator,cpe_match_0_vulnerable,cpe_match_0_cpe23Uri,cpe_match_1_vulnerable,cpe_match_1_cpe23Uri,cpe_match_2_vulnerable,cpe_match_2_cpe23Uri,cpe_match_3_vulnerable,cpe_match_3_cpe23Uri,cvssV3_version,cvssV3_vectorString,cvssV3_attackVector,cvssV3_attackComplexity,cvssV3_privilegesRequired,cvssV3_userInteraction,cvssV3_scope,cvssV3_confidentialityImpact,cvssV3_integrityImpact,cvssV3_availabilityImpact,cvssV3_baseScore,cvssV3_baseSeverity,baseMetricV3_exploitabilityScore,baseMetricV3_impactScore,cvssV2_version,cvssV2_vectorString,cvssV2_accessVector,cvssV2_accessComplexity,cvssV2_authentication,cvssV2_confidentialityImpact,cvssV2_integrityImpact,cvssV2_availabilityImpact,cvssV2_baseScore,baseMetricV2_severity,baseMetricV2_exploitabilityScore,baseMetricV2_impactScore,baseMetricV2_acInsufInfo,baseMetricV2_obtainAllPrivilege,baseMetricV2_obtainUserPrivilege,baseMetricV2_obtainOtherPrivilege,baseMetricV2_userInteractionRequired,publishedDate,lastModifiedDate
CVE,MITRE,4.0,2020-09-09T08:30Z,CVE,MITRE,4.0,CVE-2015-0001,cve@mitre.org, ,CWE-264,http://packetstormsecurity.com/files/134392/Microsoft-Windows-8.1-Ahcache.sys-NtApphelpCacheControl-Privilege-Escalation.html,http://packetstormsecurity.com/files/134392/Microsoft-Windows-8.1-Ahcache.sys-NtApphelpCacheControl-Privilege-Escalation.html,MISC, ,en,"The Windows Error Reporting (WER) component in Microsoft Windows 8, Windows 8.1, Windows Server 2012 Gold and R2, and Windows RT Gold and 8.1 allows local users to bypass the Protected Process Light protection mechanism and read the contents of arbitrary process-memory locations by leveraging administrative privileges, aka ""Windows Error Reporting Security Feature Bypass Vulnerability.""",4.0,OR, , , , , , , , , , , , , , , , , , , , , , ,2.0,AV:L/AC:M/Au:N/C:P/I:N/A:N,LOCAL,MEDIUM,NONE,PARTIAL,NONE,NONE,1.9,LOW,3.4,2.9, ,False,False,False,False,2015-01-13T22:59Z,2018-10-12T22:07Z
CVE,MITRE,4.0,2020-09-09T08:30Z,CVE,MITRE,4.0,CVE-2015-0002,cve@mitre.org, ,CWE-264,http://secunia.com/advisories/61277,61277,SECUNIA, ,en,"The AhcVerifyAdminContext function in ahcache.sys in the Application Compatibility component in Microsoft Windows 7 SP1, Windows Server 2008 R2 SP1, Windows 8, Windows 8.1, Windows Server 2012 Gold and R2, and Windows RT Gold and 8.1 does not verify that an impersonation token is associated with an administrative account, which allows local users to gain privileges by running AppCompatCache.exe with a crafted DLL file, aka MSRC ID 20544 or ""Microsoft Application Compatibility Infrastructure Elevation of Privilege Vulnerability.""",4.0,OR, , , , , , , , , , , , , , , , , , , , , , ,2.0,AV:L/AC:L/Au:N/C:C/I:C/A:C,LOCAL,LOW,NONE,COMPLETE,COMPLETE,COMPLETE,7.2,HIGH,3.9,10.0, ,False,False,False,False,2015-01-13T22:59Z,2018-10-12T22:07Z
CVE,MITRE,4.0,2020-09-09T08:30Z,CVE,MITRE,4.0,CVE-2015-0003,cve@mitre.org, ,CWE-476,http://www.securityfocus.com/bid/72457,72457,BID, ,en,"win32k.sys in the kernel-mode drivers in Microsoft Windows Server 2003 SP2, Windows Vista SP2, Windows Server 2008 SP2 and R2 SP1, Windows 7 SP1, Windows 8, Windows 8.1, Windows Server 2012 Gold and R2, and Windows RT Gold and 8.1 allows local users to gain privileges or cause a denial of service (NULL pointer dereference) via a crafted application, aka ""Win32k Elevation of Privilege Vulnerability.""",4.0,OR, , , , , , , , , , , , , , , , , , , , , , ,2.0,AV:L/AC:M/Au:N/C:C/I:C/A:C,LOCAL,MEDIUM,NONE,COMPLETE,COMPLETE,COMPLETE,6.9,MEDIUM,3.4,10.0,False,False,False,False,True,2015-02-11T03:00Z,2019-05-14T19:39Z
CVE,MITRE,4.0,2020-09-09T08:30Z,CVE,MITRE,4.0,CVE-2015-0004,cve@mitre.org, ,CWE-264,http://secunia.com/advisories/61927,61927,SECUNIA, ,en,"The User Profile Service (aka ProfSvc) in Microsoft Windows Server 2003 SP2, Windows Vista SP2, Windows Server 2008 SP2 and R2 SP1, Windows 7 SP1, Windows 8, Windows 8.1, Windows Server 2012 Gold and R2, and Windows RT Gold and 8.1 allows local users to gain privileges by conducting a junction attack to load another user's UsrClass.dat registry hive, aka MSRC ID 20674 or ""Microsoft User Profile Service Elevation of Privilege Vulnerability.""",4.0,OR, , , , , , , , , , , , , , , , , , , , , , ,2.0,AV:L/AC:L/Au:N/C:C/I:C/A:C,LOCAL,LOW,NONE,COMPLETE,COMPLETE,COMPLETE,7.2,HIGH,3.9,10.0, ,False,False,False,False,2015-01-13T22:59Z,2018-10-12T22:07Z
CVE,MITRE,4.0,2020-09-09T08:30Z,CVE,MITRE,4.0,CVE-2015-0005,cve@mitre.org, ,CWE-254,http://packetstormsecurity.com/files/130773/Windows-Pass-Through-Authentication-Methods-Improper-Validation.html,http://packetstormsecurity.com/files/130773/Windows-Pass-Through-Authentication-Methods-Improper-Validation.html,MISC, ,en,"The NETLOGON service in Microsoft Windows Server 2003 SP2, Windows Server 2008 SP2 and R2 SP1, and Windows Server 2012 Gold and R2, when a Domain Controller is configured, allows remote attackers to spoof the computer name of a secure channel's endpoint, and obtain sensitive session information, by running a crafted application and leveraging the ability to sniff network traffic, aka ""NETLOGON Spoofing Vulnerability.""",4.0,OR, , , , , , , , , , , , , , , , , , , , , , ,2.0,AV:A/AC:M/Au:N/C:P/I:P/A:N,ADJACENT_NETWORK,MEDIUM,NONE,PARTIAL,PARTIAL,NONE,4.3,MEDIUM,5.5,4.9, ,False,False,False,False,2015-03-11T10:59Z,2019-05-08T22:03Z
CVE,MITRE,4.0,2020-09-09T08:30Z,CVE,MITRE,4.0,CVE-2015-0006,cve@mitre.org, ,CWE-264,http://secunia.com/advisories/62098,62098,SECUNIA, ,en,"The Network Location Awareness (NLA) service in Microsoft Windows Server 2003 SP2, Windows Vista SP2, Windows Server 2008 SP2 and R2 SP1, Windows 7 SP1, Windows 8, Windows 8.1, and Windows Server 2012 Gold and R2 does not perform mutual authentication to determine a domain connection, which allows remote attackers to trigger an unintended permissive configuration by spoofing DNS and LDAP responses on a local network, aka ""NLA Security Feature Bypass Vulnerability.""",4.0,OR, , , , , , , , , , , , , , , , , , , , , , ,2.0,AV:A/AC:L/Au:N/C:N/I:C/A:N,ADJACENT_NETWORK,LOW,NONE,NONE,COMPLETE,NONE,6.1,MEDIUM,6.5,6.9, ,False,False,False,False,2015-01-13T22:59Z,2018-10-12T22:07Z
CVE,MITRE,4.0,2020-09-09T08:30Z,CVE,MITRE,4.0,CVE-2015-0007,cve@mitre.org, ,, , , , ,en,** REJECT **  DO NOT USE THIS CANDIDATE NUMBER. ConsultIDs: none. Reason: The CNA or individual who requested this candidate did not associate it with any vulnerability during 2015. Notes: none.,4.0, , , , , , , , , , , , , , , , , , , , , , , , , , , , , , , , , , , , , , , , ,2017-05-11T14:29Z,2017-05-11T14:29Z
CVE,MITRE,4.0,2020-09-09T08:30Z,CVE,MITRE,4.0,CVE-2015-0008,cve@mitre.org, ,CWE-284,http://blogs.technet.com/b/srd/archive/2015/02/10/ms15-011-amp-ms15-014-hardening-group-policy.aspx,http://blogs.technet.com/b/srd/archive/2015/02/10/ms15-011-amp-ms15-014-hardening-group-policy.aspx,CONFIRM, ,en,"The UNC implementation in Microsoft Windows Server 2003 SP2, Windows Vista SP2, Windows Server 2008 SP2 and R2 SP1, Windows 7 SP1, Windows 8, Windows 8.1, Windows Server 2012 Gold and R2, and Windows RT Gold and 8.1 does not include authentication from the server to the client, which allows remote attackers to execute arbitrary code by making crafted data available on a UNC share, as demonstrated by Group Policy data from a spoofed domain controller, aka ""Group Policy Remote Code Execution Vulnerability.""",4.0,OR, , , , , , , , , , , , , , , , , , , , , , ,2.0,AV:A/AC:L/Au:N/C:C/I:C/A:C,ADJACENT_NETWORK,LOW,NONE,COMPLETE,COMPLETE,COMPLETE,8.3,HIGH,6.5,10.0,False,False,False,False,False,2015-02-11T03:00Z,2019-10-29T19:15Z
CVE,MITRE,4.0,2020-09-09T08:30Z,CVE,MITRE,4.0,CVE-2015-0009,cve@mitre.org, ,CWE-254,http://blogs.technet.com/b/srd/archive/2015/02/10/ms15-011-amp-ms15-014-hardening-group-policy.aspx,http://blogs.technet.com/b/srd/archive/2015/02/10/ms15-011-amp-ms15-014-hardening-group-policy.aspx,CONFIRM, ,en,"The Group Policy Security Configuration policy implementation in Microsoft Windows Server 2003 SP2, Windows Vista SP2, Windows Server 2008 SP2 and R2 SP1, Windows 7 SP1, Windows 8, Windows 8.1, Windows Server 2012 Gold and R2, and Windows RT Gold and 8.1 allows man-in-the-middle attackers to disable a signing requirement and trigger a revert-to-default action by spoofing domain-controller responses, aka ""Group Policy Security Feature Bypass Vulnerability.""",4.0,OR, , , , , , , , , , , , , , , , , , , , , , ,2.0,AV:A/AC:L/Au:N/C:N/I:P/A:N,ADJACENT_NETWORK,LOW,NONE,NONE,PARTIAL,NONE,3.3,LOW,6.5,2.9,False,False,False,False,False,2015-02-11T03:00Z,2019-10-29T19:15Z
CVE,MITRE,4.0,2020-09-09T08:30Z,CVE,MITRE,4.0,CVE-2015-0010,cve@mitre.org, ,CWE-310,http://code.google.com/p/google-security-research/issues/detail?id=128,http://code.google.com/p/google-security-research/issues/detail?id=128,MISC, ,en,"The CryptProtectMemory function in cng.sys (aka the Cryptography Next Generation driver) in the kernel-mode drivers in Microsoft Windows Server 2003 SP2, Windows Vista SP2, Windows Server 2008 SP2 and R2 SP1, Windows 7 SP1, Windows 8, Windows 8.1, Windows Server 2012 Gold and R2, and Windows RT Gold and 8.1, when the CRYPTPROTECTMEMORY_SAME_LOGON option is used, does not check an impersonation token's level, which allows local users to bypass intended decryption restrictions by leveraging a service that (1) has a named-pipe planting vulnerability or (2) uses world-readable shared memory for encrypted data, aka ""CNG Security Feature Bypass Vulnerability"" or MSRC ID 20707.",4.0,OR, , , , , , , , , , , , , , , , , , , , , , ,2.0,AV:L/AC:M/Au:N/C:P/I:N/A:N,LOCAL,MEDIUM,NONE,PARTIAL,NONE,NONE,1.9,LOW,3.4,2.9,False,False,False,False,True,2015-02-11T03:00Z,2019-05-15T17:04Z
CVE,MITRE,4.0,2020-09-09T08:30Z,CVE,MITRE,4.0,CVE-2015-0011,cve@mitre.org, ,CWE-264,http://secunia.com/advisories/62154,62154,SECUNIA, ,en,"mrxdav.sys (aka the WebDAV driver) in the kernel-mode drivers in Microsoft Windows Server 2003 SP2, Windows Vista SP2, Windows Server 2008 SP2 and R2 SP1, Windows 7 SP1, Windows 8, Windows 8.1, Windows Server 2012 Gold and R2, and Windows RT Gold and 8.1 allows local users to bypass an impersonation protection mechanism, and obtain privileges for redirection of WebDAV requests, via a crafted application, aka ""WebDAV Elevation of Privilege Vulnerability.""",4.0,OR, , , , , , , , , , , , , , , , , , , , , , ,2.0,AV:L/AC:M/Au:N/C:N/I:C/A:N,LOCAL,MEDIUM,NONE,NONE,COMPLETE,NONE,4.7,MEDIUM,3.4,6.9, ,False,False,False,True,2015-01-13T22:59Z,2018-10-12T22:07Z
CVE,MITRE,4.0,2020-09-09T08:30Z,CVE,MITRE,4.0,CVE-2015-0012,cve@mitre.org, ,CWE-264,http://www.securityfocus.com/bid/72473,72473,BID, ,en,"Microsoft System Center Virtual Machine Manager (VMM) 2012 R2 Update Rollup 4 does not properly validate the roles of users, which allows local users to obtain server and virtual-machine administrative privileges by establishing a server session with Active Directory credentials, aka ""Virtual Machine Manager Elevation of Privilege Vulnerability.""",4.0,OR, , , , , , , , , , , , , , , , , , , , , , ,2.0,AV:L/AC:M/Au:N/C:C/I:C/A:C,LOCAL,MEDIUM,NONE,COMPLETE,COMPLETE,COMPLETE,6.9,MEDIUM,3.4,10.0, ,False,False,False,False,2015-02-11T03:00Z,2018-11-20T20:29Z
CVE,MITRE,4.0,2020-09-09T08:30Z,CVE,MITRE,4.0,CVE-2015-0013,cve@mitre.org, ,, , , , ,en,** REJECT **  DO NOT USE THIS CANDIDATE NUMBER. ConsultIDs: none. Reason: The CNA or individual who requested this candidate did not associate it with any vulnerability during 2015. Notes: none.,4.0, , , , , , , , , , , , , , , , , , , , , , , , , , , , , , , , , , , , , , , , ,2017-05-11T14:29Z,2017-05-11T14:29Z
CVE,MITRE,4.0,2020-09-09T08:30Z,CVE,MITRE,4.0,CVE-2015-0014,cve@mitre.org, ,CWE-119,http://secunia.com/advisories/61580,61580,SECUNIA, ,en,"Buffer overflow in the Telnet service in Microsoft Windows Server 2003 SP2, Windows Vista SP2, Windows Server 2008 SP2 and R2 SP1, Windows 7 SP1, Windows 8, Windows 8.1, and Windows Server 2012 Gold and R2 allows remote attackers to execute arbitrary code via crafted packets, aka ""Windows Telnet Service Buffer Overflow Vulnerability.""",4.0,OR, , , , , , , , , , , , , , , , , , , , , , ,2.0,AV:N/AC:L/Au:N/C:C/I:C/A:C,NETWORK,LOW,NONE,COMPLETE,COMPLETE,COMPLETE,10.0,HIGH,10.0,10.0, ,False,False,False,False,2015-01-13T22:59Z,2018-10-12T22:07Z
CVE,MITRE,4.0,2020-09-09T08:30Z,CVE,MITRE,4.0,CVE-2015-0015,cve@mitre.org, ,CWE-399,http://secunia.com/advisories/62148,62148,SECUNIA, ,en,"Microsoft Windows Server 2003 SP2, Server 2008 SP2 and R2 SP1, and Server 2012 Gold and R2 allow remote attackers to cause a denial of service (system hang and RADIUS outage) via crafted username strings to (1) Internet Authentication Service (IAS) or (2) Network Policy Server (NPS), aka ""Network Policy Server RADIUS Implementation Denial of Service Vulnerability.""",4.0,OR, , , , , , , , , , , , , , , , , , , , , , ,2.0,AV:N/AC:L/Au:N/C:N/I:N/A:C,NETWORK,LOW,NONE,NONE,NONE,COMPLETE,7.8,HIGH,10.0,6.9, ,False,False,False,False,2015-01-13T22:59Z,2018-10-12T22:07Z
CVE,MITRE,4.0,2020-09-09T08:30Z,CVE,MITRE,4.0,CVE-2015-0016,cve@mitre.org, ,CWE-22,http://blog.trendmicro.com/trendlabs-security-intelligence/cve-2015-0016-escaping-the-internet-explorer-sandbox/,http://blog.trendmicro.com/trendlabs-security-intelligence/cve-2015-0016-escaping-the-internet-explorer-sandbox/,MISC, ,en,"Directory traversal vulnerability in the TS WebProxy (aka TSWbPrxy) component in Microsoft Windows Vista SP2, Windows 7 SP1, Windows Server 2008 R2 SP1, Windows 8, Windows 8.1, Windows Server 2012 Gold and R2, and Windows RT Gold and 8.1 allows remote attackers to gain privileges via a crafted pathname in an executable file, as demonstrated by a transition from Low Integrity to Medium Integrity, aka ""Directory Traversal Elevation of Privilege Vulnerability.""",4.0,OR, , , , , , , , , , , , , , , , , , , , , , ,2.0,AV:N/AC:M/Au:N/C:C/I:C/A:C,NETWORK,MEDIUM,NONE,COMPLETE,COMPLETE,COMPLETE,9.3,HIGH,8.6,10.0, ,False,False,False,True,2015-01-13T22:59Z,2018-10-12T22:07Z
CVE,MITRE,4.0,2020-09-09T08:30Z,CVE,MITRE,4.0,CVE-2015-0017,cve@mitre.org, ,CWE-399,http://www.securityfocus.com/bid/72402,72402,BID, ,en,"Microsoft Internet Explorer 6 through 11 allows remote attackers to execute arbitrary code or cause a denial of service (memory corruption) via a crafted web site, aka ""Internet Explorer Memory Corruption Vulnerability,"" a different vulnerability than CVE-2015-0020, CVE-2015-0022, CVE-2015-0026, CVE-2015-0030, CVE-2015-0031, CVE-2015-0036, and CVE-2015-0041.",4.0,OR, , , , , , , , , , , , , , , , , , , , , , ,2.0,AV:N/AC:M/Au:N/C:C/I:C/A:C,NETWORK,MEDIUM,NONE,COMPLETE,COMPLETE,COMPLETE,9.3,HIGH,8.6,10.0, ,False,False,False,True,2015-02-11T03:00Z,2018-10-12T22:07Z
CVE,MITRE,4.0,2020-09-09T08:30Z,CVE,MITRE,4.0,CVE-2015-0018,cve@mitre.org, ,CWE-399,http://www.securityfocus.com/bid/72403,72403,BID, ,en,"Microsoft Internet Explorer 11 allows remote attackers to execute arbitrary code or cause a denial of service (memory corruption) via a crafted web site, aka ""Internet Explorer Memory Corruption Vulnerability,"" a different vulnerability than CVE-2015-0037, CVE-2015-0040, and CVE-2015-0066.",4.0,OR, , , , , , , , , , , , , , , , , , , , , , ,2.0,AV:N/AC:M/Au:N/C:C/I:C/A:C,NETWORK,MEDIUM,NONE,COMPLETE,COMPLETE,COMPLETE,9.3,HIGH,8.6,10.0, ,False,False,False,True,2015-02-11T03:00Z,2018-10-12T22:07Z
CVE,MITRE,4.0,2020-09-09T08:30Z,CVE,MITRE,4.0,CVE-2015-0019,cve@mitre.org, ,CWE-399,http://www.securityfocus.com/bid/72425,72425,BID, ,en,"Microsoft Internet Explorer 9 and 10 allows remote attackers to execute arbitrary code or cause a denial of service (memory corruption) via a crafted web site, aka ""Internet Explorer Memory Corruption Vulnerability.""",4.0,OR, , , , , , , , , , , , , , , , , , , , , , ,2.0,AV:N/AC:M/Au:N/C:C/I:C/A:C,NETWORK,MEDIUM,NONE,COMPLETE,COMPLETE,COMPLETE,9.3,HIGH,8.6,10.0, ,False,False,False,True,2015-02-11T03:00Z,2018-10-12T22:07Z
CVE,MITRE,4.0,2020-09-09T08:30Z,CVE,MITRE,4.0,CVE-2015-0020,cve@mitre.org, ,CWE-399,http://www.securityfocus.com/bid/72426,72426,BID, ,en,"Microsoft Internet Explorer 6 through 11 allows remote attackers to execute arbitrary code or cause a denial of service (memory corruption) via a crafted web site, aka ""Internet Explorer Memory Corruption Vulnerability,"" a different vulnerability than CVE-2015-0017, CVE-2015-0022, CVE-2015-0026, CVE-2015-0030, CVE-2015-0031, CVE-2015-0036, and CVE-2015-0041.",4.0,OR, , , , , , , , , , , , , , , , , , , , , , ,2.0,AV:N/AC:M/Au:N/C:C/I:C/A:C,NETWORK,MEDIUM,NONE,COMPLETE,COMPLETE,COMPLETE,9.3,HIGH,8.6,10.0, ,False,False,False,True,2015-02-11T03:00Z,2018-10-12T22:07Z
CVE,MITRE,4.0,2020-09-09T08:30Z,CVE,MITRE,4.0,CVE-2015-0021,cve@mitre.org, ,CWE-399,http://www.securityfocus.com/bid/72436,72436,BID, ,en,"Microsoft Internet Explorer 6 through 10 allows remote attackers to execute arbitrary code or cause a denial of service (memory corruption) via a crafted web site, aka ""Internet Explorer Memory Corruption Vulnerability.""",4.0,OR, , , , , , , , , , , , , , , , , , , , , , ,2.0,AV:N/AC:M/Au:N/C:C/I:C/A:C,NETWORK,MEDIUM,NONE,COMPLETE,COMPLETE,COMPLETE,9.3,HIGH,8.6,10.0, ,False,False,False,True,2015-02-11T03:00Z,2018-10-12T22:07Z
CVE,MITRE,4.0,2020-09-09T08:30Z,CVE,MITRE,4.0,CVE-2015-0022,cve@mitre.org, ,CWE-399,http://www.securityfocus.com/bid/72437,72437,BID, ,en,"Microsoft Internet Explorer 6 through 11 allows remote attackers to execute arbitrary code or cause a denial of service (memory corruption) via a crafted web site, aka ""Internet Explorer Memory Corruption Vulnerability,"" a different vulnerability than CVE-2015-0017, CVE-2015-0020, CVE-2015-0026, CVE-2015-0030, CVE-2015-0031, CVE-2015-0036, and CVE-2015-0041.",4.0,OR, , , , , , , , , , , , , , , , , , , , , , ,2.0,AV:N/AC:M/Au:N/C:C/I:C/A:C,NETWORK,MEDIUM,NONE,COMPLETE,COMPLETE,COMPLETE,9.3,HIGH,8.6,10.0, ,False,False,False,True,2015-02-11T03:00Z,2018-10-12T22:07Z
CVE,MITRE,4.0,2020-09-09T08:30Z,CVE,MITRE,4.0,CVE-2015-0023,cve@mitre.org, ,CWE-399,http://www.securityfocus.com/bid/72438,72438,BID, ,en,"Microsoft Internet Explorer 10 allows remote attackers to execute arbitrary code or cause a denial of service (memory corruption) via a crafted web site, aka ""Internet Explorer Memory Corruption Vulnerability,"" a different vulnerability than CVE-2015-0025.",4.0,OR, , , , , , , , , , , , , , , , , , , , , , ,2.0,AV:N/AC:M/Au:N/C:C/I:C/A:C,NETWORK,MEDIUM,NONE,COMPLETE,COMPLETE,COMPLETE,9.3,HIGH,8.6,10.0, ,False,False,False,True,2015-02-11T03:00Z,2018-10-12T22:07Z
CVE,MITRE,4.0,2020-09-09T08:30Z,CVE,MITRE,4.0,CVE-2015-0024,cve@mitre.org, ,, , , , ,en,** REJECT **  DO NOT USE THIS CANDIDATE NUMBER. ConsultIDs: none. Reason: The CNA or individual who requested this candidate did not associate it with any vulnerability during 2015. Notes: none.,4.0, , , , , , , , , , , , , , , , , , , , , , , , , , , , , , , , , , , , , , , , ,2017-05-11T14:29Z,2017-05-11T14:29Z
CVE,MITRE,4.0,2020-09-09T08:30Z,CVE,MITRE,4.0,CVE-2015-0025,cve@mitre.org, ,CWE-399,http://www.securityfocus.com/bid/72439,72439,BID, ,en,"Microsoft Internet Explorer 10 allows remote attackers to execute arbitrary code or cause a denial of service (memory corruption) via a crafted web site, aka ""Internet Explorer Memory Corruption Vulnerability,"" a different vulnerability than CVE-2015-0023.",4.0,OR, , , , , , , , , , , , , , , , , , , , , , ,2.0,AV:N/AC:M/Au:N/C:C/I:C/A:C,NETWORK,MEDIUM,NONE,COMPLETE,COMPLETE,COMPLETE,9.3,HIGH,8.6,10.0, ,False,False,False,True,2015-02-11T03:00Z,2018-10-12T22:08Z
